<?xml version="1.0" encoding="UTF-8"?>
<xs:schema xmlns:xs="http://www.w3.org/2001/XMLSchema"
           xmlns:cs="http://www.example.com/course"
           targetNamespace="http://www.example.com/course"
           elementFormDefault="qualified">

    <xs:element name="courses">
        <xs:complexType>
            <xs:sequence>
                <xs:element name="course" maxOccurs="unbounded">
                    <xs:complexType>
                        <xs:sequence>
                            <xs:element name="title" type="xs:string"/>
                            <xs:element name="instructor" type="xs:string"/>
                            <xs:element name="duration" type="xs:decimal"/>
                            <xs:element name="availability" type="xs:string"/>
                        </xs:sequence>
                    </xs:complexType>
                </xs:element>
            </xs:sequence>
        </xs:complexType>
    </xs:element>

</xs:schema>
